{
  "schema_version": "1.0.0",
  "project_id": "dry-run-001",
  "created_at": "2026-09-21T09:40:00-03:00",
  "status": "partial",
  "gaps": [
    "Preço exato de mercado (USD/BRL) para umidificadores USB de 300ml com o mesmo conjunto de recursos do NebulaBrisa (luz noturna 7 cores, autodesligamento, ~8h de autonomia) não foi confirmado numericamente via busca pública. Foi possível confirmar apenas: (a) versões de entrada muito simples no TikTok Shop na faixa de US$3-5 (itens de dropship sem os mesmos recursos); (b) existência de dezenas de modelos 300ml equivalentes na Amazon (HISKFUN, Saunana, Xenzy, Riecin, 'Little Train', etc.) sem conseguir extrair o preço numérico das páginas de produto (conteúdo dinâmico não recuperado via fetch). O preço de R$79,90 do produto não pôde ser validado como competitivo ou não frente à concorrência real por falta desse dado.",
    "Não foi encontrado dado demográfico oficial/publicado do TikTok Shop especificamente para a categoria 'umidificador portátil'. A demografia descrita em audience.demographics é inferida por analogia a categorias correlatas (dorm/desk gadgets, decoração de mesa, ASMR/satisfying content) e ao tom dos anúncios encontrados, não de uma pesquisa de audiência dedicada à categoria.",
    "typical_duration_seconds foi preenchido com um valor único (20s) representando o ponto mais citado para anúncios de resposta direta de itens de baixo custo no TikTok Shop, mas as fontes indicam uma faixa (7-15s para resposta direta pura, 15-30s para formato com storytelling, 30-60s para demo/review completo), não um número fixo confirmado para esta categoria especificamente."
  ],
  "product_summary": {
    "pain_points_solved": [
      "Ar seco causado por ar-condicionado ou aquecimento em ambientes pequenos (quarto, escritório, dormitório, carro), associado a pele ressecada, lábios rachados, garganta irritada e congestão nasal/sinusite.",
      "Necessidade de umidificação pessoal/localizada (mesa de trabalho, cubículo, cabeceira) sem depender de umidificadores grandes de ambiente inteiro, que são mais caros e menos portáteis.",
      "Falta de tomada elétrica dedicada ou espaço: alimentação via USB permite uso com power bank, notebook ou carregador em contextos móveis (carro, dormitório, escritório compartilhado).",
      "Desejo de um objeto de decoração de mesa ('desk setup') que também tenha função prática, combinando luz noturna colorida com umidificação.",
      "Preocupação com operação segura/sem manutenção: autodesligamento quando a água acaba responde ao medo de dano ao aparelho ou risco quando o usuário esquece o dispositivo ligado.",
      "Necessidade de operação silenciosa para não incomodar colegas de quarto/trabalho durante o sono ou reuniões."
    ],
    "competitors": [
      {
        "name": "HISKFUN Portable Mini Humidifier (300ml, LED colorido, USB)",
        "notes": "Concorrente direto na Amazon com especificações quase idênticas ao NebulaBrisa: 300ml, USB, luz LED colorida, autodesligamento, 2 modos de neblina, operação silenciosa. Preço exato não confirmado na pesquisa (página dinâmica, não extraída).",
        "source_url": "https://www.amazon.com/Portable-Humidifier-Colorful-Personal-Shut-Off/dp/B09NGSH6RL"
      },
      {
        "name": "Xenzy 300ml USB Mini Humidifier",
        "notes": "Umidificador ultrassônico 300ml com luz noturna e autodesligamento, posicionado como presente/gadget de escritório e viagem. Especificações muito próximas às do produto em análise.",
        "source_url": "https://www.amazon.com/Xenzy-300ml-USB-Mini-Humidifier/dp/B07GXGB2LB"
      },
      {
        "name": "Saunana Portable Mini Humidifier (300ml, USB)",
        "notes": "Outro modelo genérico/marca própria com o mesmo conjunto de recursos (cores variadas, USB, 300ml), vendido para quarto, escritório e carro.",
        "source_url": "https://www.amazon.com/Portable-Humidifier-Colorful-Powered-Perfect/dp/B0C9DDCKM3"
      },
      {
        "name": "Mini umidificadores genéricos no TikTok Shop (ex.: loja 'Deyun life')",
        "notes": "Versões de entrada, mais simples (sem necessariamente 300ml/autodesligamento), vendidas na faixa de US$3,42-4,95 no TikTok Shop, frequentemente com desconto de 30-43%. Servem como referência de piso de preço psicológico da categoria na própria plataforma, mas não são comparáveis em recursos ao NebulaBrisa.",
        "source_url": "https://www.tiktok.com/shop/pdp/mini-portable-air-humidifier-by-brand-usb-essential-oil-diffuser/1729389650263904959"
      },
      {
        "name": "'Little Train' USB Humidifier (Amazon)",
        "notes": "Umidificador pessoal mini USB para escritório/quarto com função noturna e autodesligamento; mencionado em listagens associadas a tendência TikTok, reforçando que a categoria já circula como produto viral/TikTok-friendly.",
        "source_url": "https://www.amazon.com/ZWXC-Tiktok-Humidifier-Abstract-Morandi/dp/B07ZQNMWBR"
      }
    ]
  },
  "audience": {
    "demographics": "Inferência (não confirmada por dado demográfico oficial da categoria): predominantemente mulheres jovens, de adolescentes tardias a ~35 anos, incluindo estudantes universitários morando em dormitórios/repúblicas, profissionais em home office ou escritório compartilhado, e criadores/consumidores de conteúdo de 'desk setup' e decoração de ambientes pequenos. A categoria aparece consistentemente associada a contextos de quarto, mesa de trabalho e carro, e não a lares/famílias inteiras (diferente de umidificadores grandes de ambiente).",
    "language_style": "Tom informal, direto e conversacional, comum a anúncios de resposta direta no TikTok Shop: abre com a dor ('Struggling with dry air?', 'ar seco te incomodando?'), usa linguagem de benefício antes de especificação técnica, emojis moderados, e frequentemente adota o registro de recomendação pessoal/depoimento ('found this on TikTok Shop and I'm obsessed', 'algo que realmente vale a pena comprar'). Pouco jargão técnico; foco em conforto, pele, sono e ambiente.",
    "platform_behavior": "Usuários do TikTok respondem fortemente a conteúdo ASMR/satisfying (som do vapor, efeito visual da neblina, luz mudando de cor), a vídeos de 'desk setup'/room tour onde o produto aparece como parte da estética do ambiente, e a formatos de unboxing/review em primeira pessoa. Os primeiros segundos são decisivos para reter atenção antes do usuário rolar o feed; o produto costuma ser revelado logo no início do vídeo, não guardado para o final."
  },
  "creative_landscape": {
    "common_hooks": [
      "Pergunta de dor direta: 'Struggling with dry air?' / variações sobre pele ressecada, lábios rachados, garganta irritada ou nariz entupido pelo ar-condicionado/aquecedor",
      "Reveal imediato do produto soltando neblina e luz colorida nos primeiros 1-3 segundos, antes de qualquer explicação falada",
      "Formato 'algo que realmente vale a pena comprar no TikTok Shop' / achado de nicho, tom de recomendação pessoal cética-que-se-convenceu",
      "Comparação implícita antes/depois: ambiente seco e desconfortável vs. ambiente com neblina e luz ambiente",
      "Gancho de decoração/estética: 'add this to your desk setup' associando o produto a um upgrade visual de mesa/quarto, não só função"
    ],
    "common_formats": [
      "UGC estilo testemunho pessoal em selfie/frente à câmera, tom casual, falando diretamente para o espectador",
      "Desk setup / room tour, mostrando o produto integrado a um ambiente de trabalho ou quarto já organizado",
      "ASMR/satisfying: closes no vapor saindo, no som do borrifo e na troca de cores da luz noturna",
      "Demonstração rápida e sequencial dos recursos: encher o reservatório, conectar USB, ligar, trocar cor da luz, mostrar autodesligamento",
      "Unboxing curto seguido de primeira impressão de uso"
    ],
    "typical_duration_seconds": 20,
    "references": [
      "https://www.tiktok.com/@shopgma/video/7320326398957325614",
      "https://zeely.ai/blog/hooks-for-tiktok-video-ads/",
      "https://tslagency.co.uk/tiktok-shop-ad-creative-2026/",
      "https://stackinfluence.com/blog/best-tiktok-video-lengths-for-creators-in-2026",
      "https://www.tiktok.com/discover/rain-cloud-humidifier-asmr",
      "https://www.tiktok.com/tag/humidifier?lang=en"
    ]
  }
}
